{"$schema":"https://json-schema.org/draft/2020-12/schema","$id":"ciso-ai-risk.schema.json","title":"CISO AI Risk Decision Record","type":"object","required":["governed_system_reference","accountable_roles","governance_decision","decision_expiration","stop_condition","evidence","dependencies"],"properties":{"governed_system_reference":{"type":"string"},"accountable_roles":{"type":"object"},"governance_decision":{"enum":["authorized","conditionally_authorized","denied","hold"]},"decision_expiration":{"type":"string"},"top_condition":{"type":["string","null"]},"stop_condition":{"type":"string"},"evidence":{"type":"array"},"dependencies":{"type":"array"},"decision_pack_manifest_sha256":{"type":"string"}}}
