{"governed_system_reference":"SYSTEM-SYNTH-CS-001","accountable_roles":{"business_owner":"Customer Operations","technical_owner":"Platform Engineering","security_reviewer":"Security Review","residual_risk_acceptance_authority":"Risk Committee","privacy_reviewer":"Privacy Review","legal_reviewer":"Legal Review"},"governance_decision":"conditionally_authorized","decision_expiration":"2027-01-31T00:00:00Z","top_condition":"Keep human review on every proposed customer action.","stop_condition":"Stop use if monitoring fails or an action bypasses human review.","evidence":[{"type":"ARTIFACT_ID","reference":"SYNTH-CISO-EVIDENCE-001"}],"dependencies":[{"id":"agentic-stateful-revocation","state":"NOT_YET_ESTABLISHED"}]}
